<VicinityDetails xmlns="http://iaws/ws/contractfirst/covoiturage"
	xmlns:xsi="http://www.w3.org/2001/XMLSchema-instance"
	xsi:schemaLocation="http://iaws/ws/contractfirst/covoiturage VicinityRequest.xsd">
	
	<Personnel>
		<Identite>
			<Nom>LastName</Nom>
			<Prenom>FirstName</Prenom>
		</Identite>
		<Mail>
			<Perso>firstname.lastname</Perso>
			<Domaine>univ-tlse3.fr</Domaine>
		</Mail>
	</Personnel>
	
	<Personnel>
		<Identite>
			<Nom>Bob</Nom>
			<Prenom>Gaston</Prenom>
		</Identite>
		<Mail>
			<Perso>gaston.bob</Perso>
			<Domaine>univ-tlse3.fr</Domaine>
		</Mail>
	</Personnel>
	
</VicinityDetails>
